{
  "schemaVersion": "1.0",
  "templateId": "photo_left_text_right_yuko_v1",
  "name": "写真左・説明右・ゆうこ",
  "description": "オフィスや社員紹介向け。左に写真スロット、右に説明パネルとゆうこを置く。",
  "category": "photo_intro",
  "aspectRatio": "16:9",
  "canvas": { "width": 1920, "height": 1080 },
  "aiHint": {
    "useCase": "オフィス紹介、社員紹介、仕事風景紹介",
    "recommendedSceneTypes": ["photo_intro", "video_intro"],
    "maxDurationSec": 15,
    "maxNarrationLength": 120,
    "maxSubtitleLength": 60
  },
  "defaults": {
    "durationSec": 10,
    "transitionIn": "fade",
    "transitionOut": "fade",
    "backgroundColor": "#f5f5f5"
  },
  "layers": [
    { "id": "background", "type": "background", "x": 0, "y": 0, "w": 1920, "h": 1080, "zIndex": 0, "fillColor": "#f5f5f5" },
    { "id": "mainVisual", "type": "slot", "slotType": "image_or_video", "required": true, "x": 80, "y": 140, "w": 1040, "h": 800, "zIndex": 10, "fit": "cover" },
    { "id": "textPanel", "type": "shape", "shapeType": "rect", "x": 1180, "y": 200, "w": 660, "h": 520, "zIndex": 20, "fillColor": "#ffffff", "opacity": 0.9, "radius": 24 },
    { "id": "title", "type": "text", "textKey": "title", "required": true, "x": 1230, "y": 250, "w": 560, "h": 110, "zIndex": 30, "fontSize": 52, "fontWeight": "bold", "color": "#1a1a1a", "maxLines": 2, "autoResize": true },
    { "id": "main", "type": "text", "textKey": "main", "required": false, "x": 1230, "y": 390, "w": 560, "h": 200, "zIndex": 30, "fontSize": 34, "color": "#333333", "maxLines": 4, "autoResize": true },
    { "id": "subtitle", "type": "subtitle", "textKey": "subtitle", "x": 240, "y": 960, "w": 1440, "h": 90, "zIndex": 50, "fontSize": 38, "maxLines": 2, "background": { "enabled": true, "color": "#000000", "opacity": 0.55, "radius": 16 } },
    { "id": "yuko", "type": "character", "required": false, "x": 1500, "y": 640, "w": 340, "h": 400, "zIndex": 40, "fit": "contain", "defaultPoseTag": "guide", "allowHidden": true }
  ]
}
